{
  "id": "postgres-py",
  "version": "1.0.0",
  "languages": ["py"],
  "backend": "postgres",
  "detect": { "lang_any": ["pyproject.toml", "requirements.txt", "Pipfile", "setup.py"] },
  "triggers": ["python", "py", "fastapi", "flask", "django", "psycopg", "psycopg2", "sqlalchemy", "alembic", "postgres", "pg", "rls", "row level security", "secret", "segret", "authz", "autorizzazione", "blueprint", "audit", "remediat", "bonific", "macrotask", "oracol", "sicur", "security"],
  "oracles": {
    "secret":          { "tool": "gitleaks", "shared": true },
    "dependency-vuln": { "tool": "osv", "lockfiles": ["requirements.txt", "poetry.lock", "Pipfile.lock"] },
    "rls":             { "tool": "rls_check", "kind": "postgres-rls", "scan": ["migrations", "db/migrations", "supabase/migrations"], "role": "authz-surface" },
    "injection":       { "tool": "semgrep", "ruleset": "ruleset/" },
    "dead-code":       { "tool": "vulture" }
  },
  "test_runner": { "detect": ["pytest", "unittest"] },
  "floor":        ["secret", "dependency-vuln", "rls"],
  "verified_set": [],
  "coverage_policy": "declared"
}
